{
  "surface": "rondo.core/v1",
  "repo_id": "sample-repo",
  "run_id": "RUN-sample-0001",
  "events": [
    {
      "type": "rondo.run.status_changed",
      "sequence": 3,
      "repo_id": "sample-repo",
      "run_id": "RUN-sample-0001",
      "status": "completed",
      "timestamp": "2026-05-10T15:30:40Z",
      "namespace": { "repo_id": "sample-repo", "run_id": "RUN-sample-0001" }
    },
    {
      "type": "rondo.run.evidence_recorded",
      "sequence": 4,
      "repo_id": "sample-repo",
      "run_id": "RUN-sample-0001",
      "artifact_kind": "agent_events",
      "uri": "rondo-run://RUN-sample-0001/artifacts/agent-events.ndjson",
      "timestamp": "2026-05-10T15:30:40Z",
      "namespace": { "repo_id": "sample-repo", "run_id": "RUN-sample-0001" }
    },
    {
      "type": "rondo.run.evidence_recorded",
      "sequence": 5,
      "repo_id": "sample-repo",
      "run_id": "RUN-sample-0001",
      "artifact_kind": "delivery_artifact",
      "uri": "rondo-run://RUN-sample-0001/artifacts/delivery-artifact.json",
      "timestamp": "2026-05-10T15:30:40Z",
      "namespace": { "repo_id": "sample-repo", "run_id": "RUN-sample-0001" }
    }
  ],
  "next_event_cursor": "rondo.core/v1:5",
  "has_more": false
}
